lastUpdated,text,title,url
2020-05-11 21:48:00,"For the political term, see Benevolent dictatorship.Benevolent dictator for life (BDFL) is a title given to a small number of open-source software development leaders, typically project founders who retain the final say in disputes or arguments within the community. The phrase originated in 1995 with reference to Guido van Rossum, creator of the Python programming language.[1][2] Shortly after Van Rossum joined the Corporation for National Research Initiatives, the term appeared in a follow-up mail by Ken Manheimer to a meeting trying to create a semi-formal group that would oversee Python development and workshops; this initial use included an additional joke of naming Van Rossum the ""First Interim BDFL"".[1] Van Rossum announced on July 12, 2018, that he would be stepping down as BDFL of Python.[3]BDFL should not be confused with the more common term for open-source leaders, ""benevolent dictator"", which was popularized by Eric S. Raymond's essay ""Homesteading the Noosphere"" (1999).[4] Among other topics related to hacker culture, Raymond elaborates on how the nature of open source forces the ""dictatorship"" to keep itself benevolent, since a strong disagreement can lead to the forking of the project under the rule of new leaders.
Referrant candidates[edit]

Name
Project
",Benevolent dictator for life,https://en.wikipedia.org/wiki/Benevolent_dictator_for_life
2020-03-20 18:19:00,"Dolibarr ERP CRMDeveloper(s)Dolibarr team (Project leader: Laurent Destailleur)Stable release11.0.3
   / March 19, 2020; 55 days ago (2020-03-19)Repositorysourceforge.net/projects/dolibarr/files/Written inPHPOperating systemCross-platformTypeERP, CRM, Accounting, SaaSLicenseGNU General Public License 3.0Websitewww.dolibarr.orgDolibarr ERP CRM is an open source, free software package for small and medium companies, foundations or freelancers. It includes different features for enterprise resource planning (ERP) and customer relationship management (CRM) but also other features for different activities.[",Dolibarr,https://en.wikipedia.org/wiki/Dolibarr
2020-04-17 04:25:00,"Adrian HolovatyAdrian Holovaty in 2009Born1981 (age 38–39)Naperville, IllinoisNationalityUSAAlma materMissouri School of Journalism (B.A., 2001)Occupationweb developer, journalist, entrepreneurKnown forDjango Web frameworkAdrian Holovaty (born 1981) is an American web developer, journalist and entrepreneur from Chicago, Illinois, living in Amsterdam, the Netherlands. He is co-creator of the Django web framework and an advocate of ""journalism via computer programming"".
Contents1Life and career1.1Crime mapping innovations2References3External links

Life and career[",Adrian Holovaty,https://en.wikipedia.org/wiki/Adrian_Holovaty
2020-05-08 10:14:00,Approach to manage a company's interaction with current and potential customersBusiness administrationManagement of a businessAccountingManagement accountingFinancial accountingFinancial auditBusiness entitiesCorporate groupConglomerate (company)Holding companyCooperativeCorporationJoint-stock companyLimited liability companyPartnershipPrivately held companySole proprietorshipState-owned enterpriseCorporate governanceAnnual general meetingBoard of directors,Customer relationship management,https://en.wikipedia.org/wiki/Customer_Relationship_Management
2020-05-05 08:41:00,"For similarly sounding names, see closure.A modern, dynamic, and functional Lisp on JVMClojureParadigmmulti-paradigm:
agent-oriented[1]concurrent[2][3]functional[4]logic[5]macro[6]pipeline[7]FamilyLispDesigned byRich HickeyFirst appeared2007; 13 years ago (2007)Stable release1.10.1[8]
   / June 6, 2019; 11 months ago (2019-06-06)Typing discipline",Clojure,https://en.wikipedia.org/wiki/Rich_Hickey
2020-05-07 19:00:00,"Not to be confused with Ruby (programming language).Ruby on RailsOriginal author(s)David Heinemeier HanssonInitial release13 December 2005; 14 years ago (2005-12-13)[1]Stable release6.0.3 (May 6, 2020; 2 days ago (2020-05-06)[2]) [±]RepositoryRails RepositoryWritten inRubySize57.8 MB[3]TypeWeb application frameworkLicenseMIT LicenseWebsiterubyonrails.orgRuby on Rails, or Rails, is a server-sideweb application framework written in Ruby under the ",Ruby on Rails,https://en.wikipedia.org/wiki/Ruby_on_Rails
2020-04-30 21:40:00,"Web content management systemDrupalDrupal 8 in action. Showing in-context editing and previews (WYSIWYG).Original author(s)Dries BuytaertDeveloper(s)Drupal communityInitial releaseMay 18, 2000; 19 years ago (2000-05-18)[1]Stable release8.8.5[2]
   / 2020-04-02[±]Preview release9.0.0-beta2
   / 2020-03-30[2]RepositoryDrupal RepositoryWritten inPHP, using SymfonyOperating systemUnix-like, WindowsPlatformWeb platformSize80 MB (uncompressed Drupal 8 core)[3]TypeContent management framework, content management system, blog softwareLicenseGPLv2+[4]",Drupal,https://en.wikipedia.org/wiki/Drupal
2020-04-16 09:59:00,"Not to be confused with David Hanson (computer scientist).David Heinemeier HanssonHansson at the 2006 O'Reilly Emerging Technology ConferenceBorn (1979-10-15) 15 October 1979 (age 40)[1]Copenhagen, DenmarkOther namesDHHOccupationProgrammer[2]EmployerBasecampKnown forRuby on RailsWebsitedhh.dkDavid Heinemeier Hansson (born 15 October 1979) is a Danishprogrammer, racing driver and the creator of the popular Ruby on Railsweb developmentframework and the Instiki wiki.[3] He is also a partner at the web-based software development firm Basecamp. 
Hansson co-wrote ",David Heinemeier Hansson,https://en.wikipedia.org/wiki/David_Heinemeier_Hansson
2020-01-12 00:14:00,"  Dries Buytaert at FOSDEM 2008.Dries Buytaert (born 19 November 1978 in Wilrijk, Antwerp, Belgium)[1] is an open-source softwareprogrammer notable as founder and lead developer of the Drupal content management system.[2][3][4]Contents1Career2References3External links3.1Interviews3.2Talks",Dries Buytaert,https://en.wikipedia.org/wiki/Dries_Buytaert
2020-05-05 08:41:00,"For similarly sounding names, see closure.A modern, dynamic, and functional Lisp on JVMClojureParadigmmulti-paradigm:
agent-oriented[1]concurrent[2][3]functional[4]logic[5]macro[6]pipeline[7]FamilyLispDesigned byRich HickeyFirst appeared2007; 13 years ago (2007)Stable release1.10.1[8]
   / June 6, 2019; 10 months ago (2019-06-06)Typing discipline",Clojure,https://en.wikipedia.org/wiki/Clojure
2020-05-11 17:43:00,"This article relies too much on references to primary sources. Please improve this  by adding secondary or tertiary sources.  (May 2019) (Learn how and when to remove this template message)ElmParadigmFunctionalDesigned byEvan CzaplickiFirst appearedMarch 30, 2012; 8 years ago (2012-03-30)[1]Stable release0.19.1
   / October 21, 2019; 6 months ago (2019-10-21)[2]Typing disciplineStatic, Strong, InferredLicensePermissive (Revised BSD)[3]Filename extensions",Elm (programming language),https://en.wikipedia.org/wiki/Elm_(programming_language)
2020-05-12 18:36:00,"body.skin-minerva .mw-parser-output table,body.skin-minerva .mw-parser-output tr,body.skin-minerva .mw-parser-output td,body.skin-minerva .mw-parser-output tbody{display:block!important;width:100%!important;box-sizing:border-box}body.skin-minerva .mw-parser-output #mp-topbanner{min-width:0!important;white-space:initial!important}body.skin-minerva .mw-parser-output #mp-topbanner>ul{display:none}body.skin-minerva .mw-parser-output #mp-topbanner>div{width:auto!important}body.skin-minerva .mw-parser-output #mp-tfp tr td:first-child a{text-align:center;display:block}body.skin-minerva .mw-parser-output #sister-projects-list>div{width:49%}Welcome to Wikipedia,the freeencyclopedia that anyone can edit.6,077,165 articles in EnglishArtsBiographyGeographyHistoryMathematicsScienceSocietyTechnologyAll portalsFrom today's featured articleConnor Trinneer",Main Page,https://en.wikipedia.org/wiki/Main_Page
2020-05-04 23:25:00,"Open source blockchain computing platformEthereumEthereum LogoOriginal author(s)Vitalik Buterin, Gavin WoodDeveloper(s)Ethereum FoundationInitial release30 July 2015; 4 years ago (2015-07-30)Stable releaseMuir Glacier / 1 January 2020; 4 months ago (2020-01-01)Development statusActiveSoftware usedEVM 1 BytecodeWritten inGo, Rust,  C#,  C++, Java, PythonOperating systemCross-platformPlatformx86-64, ARMSize300 GB (2020-03)TypeDistributed ComputingLicense",Ethereum,https://en.wikipedia.org/wiki/Ethereum
2020-02-28 11:59:00,"This article has multiple issues. Please help improve it or discuss these issues on the talk page. (Learn how and when to remove these template messages)
      This article's factual accuracy may be compromised due to out-of-date information. Please update this article to reflect recent events or newly available information.  (November 2010)This article needs additional citations for verification. Please help improve this article by adding citations to reliable sources. Unsourced material may be challenged and removed.Find sources: ""Linux.com"" – news ·newspapers ·books ·scholar ·",Linux.com,https://en.wikipedia.org/wiki/Linux.com
2020-05-10 09:02:00,"  Mustafa Kemal Atatürk in 1923A benevolent dictatorship refers to a government in which an authoritarian leader exercises absolute political power over the state but is perceived to do so with regard for benefit of the population as a whole, standing in contrast to the decidedly malevolent stereotype of a dictator who focuses on their and their supporters' self-interests. A benevolent dictator may allow for some economic liberalization or democratic decision-making to exist, such as through public referenda or electedrepresentatives with limited power, and often makes preparations for a transition to genuine democracy during or after their term. It might be seen as a republican form of enlightened despotism.
The label has been applied to leaders such as Sultan Qaboos bin Said of Oman (1970–2020),[1]Mustafa Kemal Atatürk of Turkey (1923–38),[2]Josip Broz Tito of Yugoslavia (1953–80),[3]Lee Kuan Yew of ",Benevolent dictatorship,https://en.wikipedia.org/wiki/Benevolent_dictatorship
2020-03-29 01:06:00,"Russian-Canadian programmer and writerVitalik ButerinVitalik Buterin, 2016Born (1994-01-31) January 31, 1994 (age 26)Kolomna, RussiaNationalityRussian-CanadianAlma materUniversity of Waterloo(dropped out)Known forEthereum, Bitcoin MagazineAwardsThiel FellowshipScientific careerFieldsDigital contracts, digital currencies, game theoryWebsitevitalik.caVitaly Dmitriyevich ""Vitalik"" Buterin (Russian: Виталий Дмитриевич Бутерин; born January 31, 1994) is a Russian-Canadianprogrammer and writer primarily known as a co-founder of Ethereum and as a co-founder of ",Vitalik Buterin,https://en.wikipedia.org/wiki/Vitalik_Buterin
2020-05-11 21:15:00,"Social networking service for neighborhoodsNextdoor Inc.Type of businessPrivateType of siteSocial networking serviceFounded2008; 12 years ago (2008)HeadquartersSan Francisco, California, USArea servedAustralia, France, Germany, Italy, Netherlands, Spain, Sweden, United Kingdom, United States, Canada, Denmark[1]Founder(s)Sarah Leary, Nirav Tolia, Prakash Janakiraman, David WiesenKey peopleSarah Friar (CEO)URLnextdoor.comNative client(s) oniOS, Android, webNextdoor is a hyperlocalsocial networking service. Based in San Francisco, California, the company was founded in 2008 and launched in the United States in October 2011,[2] and is currently available in 11 countries.
Users of Nextdoor submit their real names and addresses (or street without the exact number) to the website; posts made to the website are available only to other Nextdoor members living in the same neighborhood.[3] There were over 10 million users as of February 2018.[4]",Nextdoor,https://en.wikipedia.org/wiki/Nextdoor
2020-04-26 09:31:00,"International authority fileFor use of VIAF with Wikipedia, see Wikipedia:Authority control and Wikipedia:VIAF/errors.Virtual International Authority FileScreenshot 2012AcronymVIAFOrganisationOCLCIntroducedAugust 6, 2003 (2003-08-06)Example106965171Websiteviaf.orgThe Virtual International Authority File (VIAF) is an international authority file. It is a joint project of several national libraries and operated by the Online Computer Library Center (OCLC).[1]Contents1History2VIAF clusters3",Virtual International Authority File,https://en.wikipedia.org/wiki/VIAF_(identifier)
2020-05-11 06:42:00,"Python web frameworkFor other uses, see Django (disambiguation).DjangoOriginal author(s)Adrian Holovaty, Simon WillisonDeveloper(s)Django Software FoundationInitial release21 July 2005; 14 years ago (2005-07-21)[1]Stable release3.0.6
   / 4 May 2020; 7 days ago (2020-05-04)[2]RepositoryDjango RepositoryWritten inPythonSize8.6 MB[3]TypeWeb frameworkLicense3-clause BSDWebsitewww.djangoproject.com/ Django (",Django (web framework),https://en.wikipedia.org/wiki/Django_(web_framework)
2020-03-14 19:26:00,"The examples and perspective in this article may not represent a worldwide view of the subject. You may improve this article, discuss the issue on the talk page, or create a new article, as appropriate.  (September 2014) (Learn how and when to remove this template message)Business administrationManagement of a businessAccountingManagement accountingFinancial accountingFinancial auditBusiness entitiesCorporate groupConglomerate (company)Holding companyCooperativeCorporationJoint-stock companyLimited liability company",Supervisory board,https://en.wikipedia.org/wiki/Supervisory_board
2020-05-11 19:03:00,"Not to be confused with ICCU SBN.Unique numeric book identifierInternational Standard Book NumberA 13-digit ISBN, 978-3-16-148410-0, as represented by an EAN-13 bar codeAcronymISBNOrganisationInternational ISBN AgencyIntroduced1970; 50 years ago (1970)No. of digits13 (formerly 10)Check digitWeighted sumExample978-3-16-148410-0Websiteisbn-international.orgThe International Standard Book Number (ISBN) is a numeric commercial bookidentifier which is intended to be unique.[a][b] Publishers purchase ISBNs from an affiliate of the International ISBN Agency.[1]An ISBN is assigned to each separate edition and variation (except reprintings) of a publication. For example, an e-book, a paperback",International Standard Book Number,https://en.wikipedia.org/wiki/ISBN_(identifier)
2020-05-11 09:56:00,"Type of governing body for an organisation""Board room"" and ""board of trustees"" redirect here. For other uses, see supervisory board, board room (disambiguation), and board of trustees (disambiguation).  A meeting of a board of directors of the Leipzig–Dresden Railway Company in 1852A board of directors is a group of people who jointly supervise the activities of an organization, which can be either a for-profit business, nonprofit organization, or a government agency. Such a board's powers, duties, and responsibilities are determined by government regulations (including the jurisdiction's corporations law) and the organization's own constitution and bylaws. These authorities may specify the number of members of the board, how they are to be chosen, and how often they are to meet.
In an organization with voting members, the board is accountable to, and might be subordinate to, the organization's full membership, which usually vote for the members of the board. In a stock corporation, non-executive directors are voted for by the shareholders, with the board having ultimate responsibility for the management of the corporation. The board of directors appoints the chief executive officer of the corporation and sets out the overall strategic direction. In corporations with dispersed ownership, the identification and nomination of directors (that shareholders vote for or against) are often done by the board itself, leading to a high degree of self-perpetuation. In a non-stock corporation with no general voting membership, the board is the supreme governing body of the institution, and its members are sometimes chosen by the board itself.[1][2][3]Contents",Board of directors,https://en.wikipedia.org/wiki/Board_of_directors
2020-04-28 16:24:00,"Executive positionThis article possibly contains original research. Please improve it by verifying the claims made and adding inline citations. Statements consisting only of original research should be removed.  (May 2018) (Learn how and when to remove this template message)A chief operating officer (COO), also called a chief operations officer, is one of the highest-ranking executive positions in an organization, comprising part of the ""C-suite"". The COO is usually the second-in-command at the firm, especially if the highest-ranking executive is the chairman and CEO. The COO is responsible for the daily operation of the company[1] and routinely reports to the highest-ranking executive—usually the chief executive officer (CEO).[2]Contents1Responsibilities and similar titles",Chief operating officer,https://en.wikipedia.org/wiki/Chief_operating_officer
2020-05-13 12:39:00,"Online platform that facilitates the building of social relationsThis article is about the type of service. For the social science theoretical concept of relationships between people, see Social network. For a list of services, see List of social networking websites.A social networking service (also social networking site or social media) is an online platform which people use to build social networks or social relationships with other people who share similar personal or career interests, activities, backgrounds or real-life connections.
Social networking services vary in format and the number of features. They can incorporate a range of new information and communication tools, operating on desktops and on laptops, on mobile devices such as tablet computers and smartphones. They may feature digital photo/video/sharing and diary entries online (blogging).[1]Online community services are sometimes considered social-network services by developers and users, though in a broader sense, a social-network service usually provides an individual-centered service whereas online community services are group-centered. Defined as ""websites that facilitate the building of a network of contacts in order to exchange various types of content online,"" social networking sites provide a space for interaction to continue beyond in person interactions. These computer mediated interactions link members of various networks and may help to both maintain and develop new social and professional relationships [2]Social networking sites allow users to share ideas, digital photos and videos, posts, and to inform others about online or real-world activities and events with people in their network. While in-person social networking – such as gathering in a village market to talk about events – has existed since the earliest development of towns,[3] the web enables people to connect with others who live in different locations, ranging from across a city to across the world. Depending on the social media platform, members may be able to contact any other member. In other cases, members can contact anyone they have a connection to, and subsequently anyone that contact has a connection to, and so on. The success of social networking services can be seen in their dominance in society today, with Facebook having a massive 2.13 billion active monthly users and an average of 1.4 billion daily active users in 2017.[4]LinkedIn, a career-oriented social-networking service, generally requires that a member personally know another member in real life before they contact them online. Some services require members to have a preexisting connection to contact other members.
The main types of social networking services contain category places (such as age or occupation or religion), means to connect with friends (usually with self-description pages), and a recommendation system linked to trust. One can categorize social-network services into four types:[5]",Social networking service,https://en.wikipedia.org/wiki/Social_networking_service
2020-02-18 04:47:00,"American businessBasecamp, LLCTypePrivately held companyFounded1999; 21 years ago (1999)FounderJason FriedCarlos SeguraErnest KimHeadquartersChicago, Illinois, United StatesKey peopleJason FriedDavid Heinemeier HanssonProductsBasecamp, Ruby on Rails, HighriseServicesWeb applicationsNumber of employees51 (2019)[1]Websitewww.basecamp.comBasecamp is a remote software company based in Chicago, Illinois. The firm was co‑founded in 1999 by Jason Fried, Carlos Segura, and Ernest Kim as a ",Basecamp (company),https://en.wikipedia.org/wiki/Basecamp_(company)
2020-03-04 15:17:00,"Corporate title""CFO"" redirects here. For other uses, see CFO (disambiguation).
The chief financial officer (CFO) is the officer of a company that has primary responsibility for managing the company's finances, including financial planning, management of financial risks, record-keeping, and financial reporting. In some sectors, the CFO is also responsible for analysis of data. Some CFOs have the title CFOO for chief financial and operating officer.[1] In the United Kingdom, the typical term for a CFO is finance director (FD). The CFO typically reports to the chief executive officer (CEO) and the board of directors and may additionally have a seat on the board. The CFO supervises the finance unit and is the chief financial spokesperson for the organization. The CFO directly assists the chief operating officer (COO) on all strategic and tactical matters relating to budget management, cost–benefit analysis, forecasting needs, and securing of new funding.
Contents1Qualification2Federal government of the United States3",Chief financial officer,https://en.wikipedia.org/wiki/Chief_financial_officer
2020-05-11 20:57:00,"This article is about people who write computer software. For other uses, see Programmer (disambiguation).For someone who performs coding in the social sciences, see Coding (social sciences).For someone who performs medical coding, see Medical coding.""Coder"" redirects here. For the settlement in Pennsylvania, see Coder, Pennsylvania.Person who writes computer software  Two programmers working on an IBM 704 at NACA, 1954A computer programmer, sometimes called only programmer or more recently a coder (especially in more informal contexts), is a person who creates computer software. The term computer programmer can refer to a specialist in one area of computers, or to a generalist who writes code for many kinds of software.
A programmer's most oft-used computer language (e.g., Assembly, COBOL, C, C++",Programmer,https://en.wikipedia.org/wiki/Programmer
2020-04-17 12:00:00,"

Part of a series onEconomicsIndexOutlineCategoryHistoryBranchesClassificationHistory of economicsSchools of economicsMainstream economicsHeterodox economicsEconomic methodologyEconomic theoryPolitical economyMicroeconomicsMacroeconomicsInternational economicsApplied economicsMathematical economicsEconometrics",Econometrics,https://en.wikipedia.org/wiki/Econometrics
2019-09-04 19:56:00,"  Fuji Speedway mapThe 2014 6 Hours of Fuji was an endurancesports car racing event held at the Fuji Speedway, Oyama, Japan on 10–12 October 2014, and served as the fifth race of the 2014 FIA World Endurance Championship season. Sébastien Buemi and Anthony Davidson won the race driving the No. 8 Toyota TS040 Hybrid car.[1]Contents1Qualifying1.1Qualifying result2Race2.1Race result",2014 6 Hours of Fuji,https://en.wikipedia.org/wiki/2014_6_Hours_of_Fuji
2020-05-12 23:52:00,"Capital city of DenmarkThis article is about the city in Denmark. For other uses, see Copenhagen (disambiguation). For the ship named København, see København (ship).

City and province in Capital, DenmarkCopenhagenKøbenhavnCity and provinceCity of CopenhagenByen KøbenhavnFrom upper left: Christiansborg Palace, Frederik's Church, Tivoli Gardens and NyhavnGreater coat of armsCopenhagenLocation within DenmarkShow map of DenmarkCopenhagenLocation within ScandinaviaShow map of ScandinaviaCopenhagenLocation within EuropeShow map of EuropeCoordinates: 55°40′34″N12°34′06″E﻿ / ﻿55.67611°N 12.56833°E﻿ / 55.67611; 12.56833Coordinates: 55°40′34″N12°34′06″E",Copenhagen,https://en.wikipedia.org/wiki/Copenhagen
2020-05-05 07:39:00,"Scandinavian countryThis article is about the country in Europe. For other uses, see Denmark (disambiguation).""Kingdom of Denmark"" redirects here. For the relationship between Denmark, the Faroe Islands, and Greenland, see Danish Realm.Coordinates: 56°N10°E﻿ / ﻿56°N 10°E﻿ / 56; 10

Kingdom of DenmarkKongeriget Danmark  (Danish)
        
            
            Flag
        
        
            
             Coat of arms
        
    Anthem: Der er et yndigt land(English: ""There is a lovely country"")Kong Christian stod ved højen mast",Denmark,https://en.wikipedia.org/wiki/Denmark
2020-05-11 22:59:00,"""La France"" redirects here. For other uses of ""La France"", see Lafrance. For other uses of ""France"", see France (disambiguation).Country in Western Europe

French RepublicRépublique française (French)
        
            
            Flag
        
        
            
             Emblem
        
    Motto: ""Liberté, égalité, fraternité""""Liberty, Equality, Fraternity""Anthem: ""La Marseillaise""Great Seal:Show globeShow map of EuropeLocation of metropolitan France (dark green)– in Europe (green & dark grey)",France,https://en.wikipedia.org/wiki/France
