lastUpdated,text,title,url
2019-01-26 04:26:00,"  The Silverstone CircuitThe 2014 6 Hours of Silverstone was an endurancesports car racing event held at the Silverstone Circuit near Silverstone, England on 17–20 April 2014.  The event served as the opening round of the 2014 World Endurance Championship, and overall race winners were awarded the annual Tourist Trophy by the Royal Automobile Club.  Toyota became the first Japanese manufacturer to win Silverstone's endurance race, with Anthony Davidson, Sébastien Buemi, and Nicolas Lapierre leading the team's second TS040 Hybrid to a 1–2 finish.  The race, which had run under mixed weather conditions, was stopped in the final half-hour of competition due to heavy rains and not restarted.[1]Porsche, making their return to the prototype categories with the debuting 919 Hybrid, completed the overall race podium with third place. Accidents ended the race of both Audi R18 e-tron quattro cars after the World Champions had started strongly.[2]  Rebellion Racing's Nicolas Prost",2014 6 Hours of Silverstone,https://en.wikipedia.org/wiki/2014_6_Hours_of_Silverstone
2020-03-22 07:41:00,"

  Map of the Circuit of the AmericasThe 2014 6 Hours of Circuit of the Americas was an endurancesports car racing event held for Le Mans Prototype and Le Mans Grand Touring Endurance cars at the Circuit of the Americas near Austin, Texas on 20 September 2014. It served as the fourth of eight rounds of the 2014 FIA World Endurance Championship and was the second time the race was held as part of the championship. A total of 50,334 spectators attended the event.
The No. 8 Toyota TS040 Hybrid of Sébastien Buemi, Anthony Davidson and Nicolas Lapierre won the pole position with the fastest two-lap average lap time and maintained its start-line advantage until a monsoon fell on the track and stopped the race for 77 minutes. Audi's No. 2 R18 e-tron quattro of Marcel Fässler, André Lotterer and Benoît Tréluyer and Romain Dumas, Neel Jani and Marc Lieb in the No. 14 Porsche 919 Hybrid",2014 6 Hours of Circuit of the Americas,https://en.wikipedia.org/wiki/2014_6_Hours_of_Circuit_of_the_Americas
2019-10-08 04:32:00,"  Layout of the Circuit de Spa-FrancorchampsThe 2019 Total 6 Hours of Spa-Francorchamps was an endurancesports car racing event held at the Circuit de Spa-Francorchamps, Stavelot, Belgium on 2–4 May 2019. Spa-Francorchamps served as the seventh race of the 2018–19 FIA World Endurance Championship, and was the eighth running of the event as part of the championship. The race was won by the #8 Toyota TS050 Hybrid.
Contents1Qualifying1.1Qualifying results2Race2.1Race result3Standings after the race",2019 6 Hours of Spa-Francorchamps,https://en.wikipedia.org/wiki/2019_6_Hours_of_Spa-Francorchamps
2019-01-19 13:43:00,"  The Circuit de Spa-FrancorchampsThe 2014 WEC 6 Hours of Spa-Francorchamps, formally known as the WEC 6 Heures de Spa-Francorchamps, was an endurancesports car racing event held at the Circuit de Spa-Francorchamps, Spa, Belgium on 2–3 May 2014.  Spa-Francorchamps served as the second race of the 2014 FIA World Endurance Championship.  Toyota's Anthony Davidson, Sébastien Buemi, and Nicolas Lapierre led the field to the checkered flag for their second consecutive victory of the season, ahead of Audi and the sister Toyota.  The LMP2 category also had its second consecutive winner with G-Drive Racing ahead of Jota Sport's guest entry in the series.  AF CorseFerrari held off PorscheTeam Manthey in the LMGTE Pro class, while another AF Corse Ferrari won the LMGTE Am category ahead of two Aston Martins.[1]Contents1",2014 6 Hours of Spa-Francorchamps,https://en.wikipedia.org/wiki/2014_6_Hours_of_Spa-Francorchamps
2020-04-28 04:06:00,"For the FIA World Endurance Championship contested from 1981 to 1985, see World Sportscar Championship.Not to be confused with FIM Endurance World Championship or World Enduro Championship.FIA World Endurance ChampionshipCategoryEndurance racingRegionInternationalInaugural season2012Prototype ClassesLMP1, LMP2GT ClassesLMGTE Pro, LMGTE AmTeams22Tyre suppliersMichelin, GoodyearDrivers' championLMP1:Fernando AlonsoSebastien BuemiKazuki NakajimaLMP2:Nicolas LapierrePierre ThirietAndré NegrãoLMGTE:Michael ChristensenKévin Estre",FIA World Endurance Championship,https://en.wikipedia.org/wiki/FIA_World_Endurance_Championship
